{
    "clients": [
        {
            "demand": 4100,
            "id": "Provincia 1"
        },
        {
            "demand": 3500,
            "id": "Provincia 2"
        },
        {
            "demand": 2400,
            "id": "Provincia 3"
        },
        {
            "demand": 5100,
            "id": "Provincia 4"
        },
        {
            "demand": 5000,
            "id": "Provincia 5"
        },
        {
            "demand": 4300,
            "id": "Provincia 6"
        },
        {
            "demand": 5200,
            "id": "Provincia 7"
        },
        {
            "demand": 5100,
            "id": "Provincia 8"
        },
        {
            "demand": 1600,
            "id": "Provincia 9"
        },
        {
            "demand": 3200,
            "id": "Provincia 10"
        }
    ],
    "distances": [
        {
            "destination": "Apto. 1",
            "distance": 2.0,
            "origin": "Proveedor 1"
        },
        {
            "destination": "Apto. 2",
            "distance": 30.0,
            "origin": "Proveedor 1"
        },
        {
            "destination": "Pto. 1",
            "distance": 13.0,
            "origin": "Proveedor 1"
        },
        {
            "destination": "CCAA 1",
            "distance": 4.0,
            "origin": "Proveedor 2"
        },
        {
            "destination": "CCAA 2",
            "distance": 34.0,
            "origin": "Proveedor 2"
        },
        {
            "destination": "CCAA 3",
            "distance": 5.0,
            "origin": "Proveedor 2"
        },
        {
            "destination": "CCAA 4",
            "distance": 7.0,
            "origin": "Proveedor 2"
        },
        {
            "destination": "CCAA5",
            "distance": 13.0,
            "origin": "Proveedor 2"
        },
        {
            "destination": "CCAA6",
            "distance": 43.0,
            "origin": "Proveedor 2"
        },
        {
            "destination": "CCAA7",
            "distance": 9.0,
            "origin": "Proveedor 2"
        },
        {
            "destination": "CCAA 1",
            "distance": 7.0,
            "origin": "Proveedor 3"
        },
        {
            "destination": "CCAA 2",
            "distance": 21.0,
            "origin": "Proveedor 3"
        },
        {
            "destination": "CCAA 3",
            "distance": 3.0,
            "origin": "Proveedor 3"
        },
        {
            "destination": "CCAA 4",
            "distance": 34.0,
            "origin": "Proveedor 3"
        },
        {
            "destination": "CCAA5",
            "distance": 6.0,
            "origin": "Proveedor 3"
        },
        {
            "destination": "CCAA6",
            "distance": 7.0,
            "origin": "Proveedor 3"
        },
        {
            "destination": "CCAA7",
            "distance": 18.0,
            "origin": "Proveedor 3"
        },
        {
            "destination": "CCAA 1",
            "distance": 21.0,
            "origin": "Proveedor 4"
        },
        {
            "destination": "CCAA 2",
            "distance": 23.0,
            "origin": "Proveedor 4"
        },
        {
            "destination": "CCAA 3",
            "distance": 43.0,
            "origin": "Proveedor 4"
        },
        {
            "destination": "CCAA 4",
            "distance": 87.0,
            "origin": "Proveedor 4"
        },
        {
            "destination": "CCAA5",
            "distance": 33.0,
            "origin": "Proveedor 4"
        },
        {
            "destination": "CCAA6",
            "distance": 12.0,
            "origin": "Proveedor 4"
        },
        {
            "destination": "CCAA7",
            "distance": 23.0,
            "origin": "Proveedor 4"
        },
        {
            "destination": "Provincia 1",
            "distance": 43.0,
            "origin": "Proveedor 2"
        },
        {
            "destination": "Provincia 2",
            "distance": 87.0,
            "origin": "Proveedor 2"
        },
        {
            "destination": "Provincia 3",
            "distance": 5.0,
            "origin": "Proveedor 2"
        },
        {
            "destination": "Provincia 4",
            "distance": 7.0,
            "origin": "Proveedor 2"
        },
        {
            "destination": "Provincia 5",
            "distance": 13.0,
            "origin": "Proveedor 2"
        },
        {
            "destination": "Provincia 6",
            "distance": 43.0,
            "origin": "Proveedor 2"
        },
        {
            "destination": "Provincia 7",
            "distance": 23.0,
            "origin": "Proveedor 2"
        },
        {
            "destination": "Provincia 8",
            "distance": 43.0,
            "origin": "Proveedor 2"
        },
        {
            "destination": "Provincia 9",
            "distance": 87.0,
            "origin": "Proveedor 2"
        },
        {
            "destination": "Provincia 10",
            "distance": 33.0,
            "origin": "Proveedor 2"
        },
        {
            "destination": "Provincia 1",
            "distance": 12.0,
            "origin": "Proveedor 3"
        },
        {
            "destination": "Provincia 2",
            "distance": 43.0,
            "origin": "Proveedor 3"
        },
        {
            "destination": "Provincia 3",
            "distance": 87.0,
            "origin": "Proveedor 3"
        },
        {
            "destination": "Provincia 4",
            "distance": 5.0,
            "origin": "Proveedor 3"
        },
        {
            "destination": "Provincia 5",
            "distance": 7.0,
            "origin": "Proveedor 3"
        },
        {
            "destination": "Provincia 6",
            "distance": 2.0,
            "origin": "Proveedor 3"
        },
        {
            "destination": "Provincia 7",
            "distance": 30.0,
            "origin": "Proveedor 3"
        },
        {
            "destination": "Provincia 8",
            "distance": 13.0,
            "origin": "Proveedor 3"
        },
        {
            "destination": "Provincia 9",
            "distance": 4.0,
            "origin": "Proveedor 3"
        },
        {
            "destination": "Provincia 10",
            "distance": 34.0,
            "origin": "Proveedor 3"
        },
        {
            "destination": "Provincia 1",
            "distance": 5.0,
            "origin": "Proveedor 4"
        },
        {
            "destination": "Provincia 2",
            "distance": 32.0,
            "origin": "Proveedor 4"
        },
        {
            "destination": "Provincia 3",
            "distance": 21.0,
            "origin": "Proveedor 4"
        },
        {
            "destination": "Provincia 4",
            "distance": 45.0,
            "origin": "Proveedor 4"
        },
        {
            "destination": "Provincia 5",
            "distance": 6.0,
            "origin": "Proveedor 4"
        },
        {
            "destination": "Provincia 6",
            "distance": 56.0,
            "origin": "Proveedor 4"
        },
        {
            "destination": "Provincia 7",
            "distance": 12.0,
            "origin": "Proveedor 4"
        },
        {
            "destination": "Provincia 8",
            "distance": 33.0,
            "origin": "Proveedor 4"
        },
        {
            "destination": "Provincia 9",
            "distance": 21.0,
            "origin": "Proveedor 4"
        },
        {
            "destination": "Provincia 10",
            "distance": 45.0,
            "origin": "Proveedor 4"
        },
        {
            "destination": "CCAA 1",
            "distance": 9.0,
            "origin": "Apto. 1"
        },
        {
            "destination": "CCAA 2",
            "distance": 16.0,
            "origin": "Apto. 1"
        },
        {
            "destination": "CCAA 3",
            "distance": 22.0,
            "origin": "Apto. 1"
        },
        {
            "destination": "CCAA 4",
            "distance": 11.0,
            "origin": "Apto. 1"
        },
        {
            "destination": "CCAA5",
            "distance": 17.0,
            "origin": "Apto. 1"
        },
        {
            "destination": "CCAA6",
            "distance": 13.0,
            "origin": "Apto. 1"
        },
        {
            "destination": "CCAA7",
            "distance": 4.0,
            "origin": "Apto. 1"
        },
        {
            "destination": "CCAA 1",
            "distance": 34.0,
            "origin": "Apto. 2"
        },
        {
            "destination": "CCAA 2",
            "distance": 5.0,
            "origin": "Apto. 2"
        },
        {
            "destination": "CCAA 3",
            "distance": 32.0,
            "origin": "Apto. 2"
        },
        {
            "destination": "CCAA 4",
            "distance": 21.0,
            "origin": "Apto. 2"
        },
        {
            "destination": "CCAA5",
            "distance": 45.0,
            "origin": "Apto. 2"
        },
        {
            "destination": "CCAA6",
            "distance": 7.0,
            "origin": "Apto. 2"
        },
        {
            "destination": "CCAA7",
            "distance": 13.0,
            "origin": "Apto. 2"
        },
        {
            "destination": "CCAA 1",
            "distance": 43.0,
            "origin": "Pto. 1"
        },
        {
            "destination": "CCAA 2",
            "distance": 9.0,
            "origin": "Pto. 1"
        },
        {
            "destination": "CCAA 3",
            "distance": 7.0,
            "origin": "Pto. 1"
        },
        {
            "destination": "CCAA 4",
            "distance": 21.0,
            "origin": "Pto. 1"
        },
        {
            "destination": "CCAA5",
            "distance": 3.0,
            "origin": "Pto. 1"
        },
        {
            "destination": "CCAA6",